{
  "schema_version": "0.1.0",
  "session_id": "session-demo-001",
  "scenario_id": "smoke_inhalation_room_v0",
  "event_id": "event-001",
  "timestamp": "2026-06-22T09:00:00Z",
  "sequence_number": 1,
  "status": "ok",
  "warnings": [],
  "errors": [],
  "notes": ["No scenario-specific conformance rule was triggered."],
  "applied_rule_ids": ["scene-assessment-first"]
}
